{
  "schema": "urn:algaguard:schema:onboarding:credential-rotation-ack:v1",
  "schemaVersion": "1.0.0",
  "rotationId": "44444444-4444-4444-8444-444444444444",
  "deviceUuid": "aaaaaaaa-aaaa-4aaa-8aaa-aaaaaaaaaaaa",
  "deviceId": "AG-000001",
  "newCredentialId": "55555555-5555-4555-8555-555555555555",
  "result": "CONNECTED",
  "connectedAt": "2026-07-24T01:01:00Z",
  "acknowledgedAt": "2026-07-24T01:01:02Z",
  "failureCode": null
}
